共販店コード,共販店名
1000,高橋銀行株式会社
1001,佐藤運輸合同会社
1002,山本ガス有限会社
1003,株式会社後藤鉱業
1004,松本通信有限会社
1005,合同会社高橋電気
1006,藤田銀行有限会社
1007,合同会社鈴木運輸
1008,石井保険合同会社
1009,鈴木水産合同会社
1010,田中農林有限会社
1011,合同会社伊藤電気
1012,株式会社遠藤建設
1013,合同会社林食品
1014,山本建設株式会社
1015,有限会社高橋鉱業
1016,斎藤建設有限会社
1017,有限会社山本運輸
1018,岡田通信株式会社
1019,渡辺農林合同会社
1020,有限会社岡田鉱業
1021,合同会社藤井電気
1022,太田運輸合同会社
1023,株式会社山田建設
1024,松本銀行株式会社
1025,高橋銀行合同会社
1026,合同会社林食品
1027,合同会社後藤印刷
1028,松本建設有限会社
1029,株式会社佐藤電気
1030,池田鉱業合同会社
1031,斉藤食品株式会社
1032,株式会社佐藤印刷
1033,山田情報合同会社
1034,佐藤情報合同会社
1035,井上保険有限会社
1036,佐藤食品有限会社
1037,佐藤農林株式会社
1038,井上水産合同会社
1039,有限会社清水水産
1040,小林水産株式会社
1041,小川印刷合同会社
1042,森運輸株式会社
1043,坂本食品株式会社
1044,合同会社森運輸
1045,橋本銀行有限会社
1046,三浦保険有限会社
1047,株式会社長谷川鉱業
1048,中川印刷合同会社
1049,林農林合同会社
1050,中村運輸有限会社
1051,山崎水産有限会社
1052,合同会社高橋建設
1053,石井銀行合同会社
1054,有限会社佐々木通信
1055,有限会社藤原食品
1056,加藤通信有限会社
1057,合同会社田中水産
1058,阿部銀行有限会社
1059,合同会社山本ガス
1060,小林建設合同会社
1061,藤田水産合同会社
1062,渡辺建設株式会社
1063,鈴木情報有限会社
1064,合同会社石川ガス
1065,清水印刷有限会社
1066,岡田農林株式会社
1067,福田情報合同会社
1068,株式会社中村保険
1069,長谷川銀行株式会社
1070,坂本通信合同会社
1071,有限会社佐藤保険
1072,中島電気有限会社
1073,岡本銀行有限会社
1074,合同会社佐藤運輸
1075,高橋農林合同会社
1076,株式会社山崎建設
1077,株式会社小林印刷
1078,石川建設株式会社
1079,吉田建設合同会社
1080,森建設有限会社
1081,清水印刷株式会社
1082,田中保険有限会社
1083,加藤食品合同会社
1084,合同会社村上農林
1085,株式会社佐藤印刷
1086,田中ガス合同会社
1087,株式会社三浦情報
1088,藤原農林有限会社
1089,株式会社岡田印刷
1090,藤井食品合同会社
1091,合同会社松田電気
1092,山田保険合同会社
1093,株式会社高橋農林
1094,山崎運輸株式会社
1095,前田銀行株式会社
1096,株式会社吉田ガス
1097,太田情報合同会社
1098,石川運輸合同会社
1099,岡本情報有限会社
